,Source,title,description,url,image,date,keyword,article
5,https://www.reuters.com/,California to end sales of gasoline-only cars by 2035,"California on Thursday moved to require all new vehicles sold in the state by 2035 to be either electric or plug-in electric hybrids, a landmark move that could speed the end of gasoline-powered vehicles.",https://www.reuters.com/business/autos-transportation/tesla-says-california-should-toughen-ev-requirements-2022-08-25/,https://www.reuters.com/resizer/Mx5343jT6GYVuY14N8mvrQfiRTA=/60x0/filters:quality(80)/cloudfront-us-east-2.images.arcpublishing.com/reuters/6EISHYZKYBM4ZENIDZF4Z6XI6U.jpg,2022-08-25,tesla,"Aug 25 (Reuters) - California on Thursday moved to require all new vehicles sold in the state by 2035 to be either electric or plug-in electric hybrids, a landmark move that could speed the end of gasoline-powered vehicles.
California Governor Gavin Newsom first announced the plan to phase out vehicles that run only on gasoline by 2035 in September 2020. The California Air Resources Board voted on Thursday to approve the new rules, which set yearly rising zero- emission vehicle rules starting in 2026, but the Biden administration must still approve the new requirements before the plan can take effect.
California has moved faster than the federal government and other states in setting strict standards for vehicle emissions. More than a dozen other states have adopted California's earlier zero-emission requirements.
Register now for FREE unlimited access to Reuters.com
Register
""This is a historic moment for California, for our partner states and for the world as we set forth a path toward a zero emission future,"" said CARB Chair Liane Randolph.
California officials said the rules by 2037 will cut by 25% smog-causing pollution from light-duty vehicles. The rules mandate that 35% of the new cars sold be plug-in hybrid electric (PHEV), EVs or hydrogen fuel cell by 2026. That proportion will rise to 68% by 2030 and 100% by 2035.
By 2030, there will be 2.9 million fewer new gas-powered vehicles sold, widening to 9.5 million fewer conventional vehicles by 2035, CARB said.
Steve Douglas, a vice president at the Alliance for Automotive Innovation, a trade association representing General Motors Co (GM.N), Volkswagen AG (VOWG_p.DE), Toyota Motor Corp (7203.T) and other automakers, said on Thursday the CARB rules ""are the most sweeping and transformative regulations in the history of the automobile.""
Electric car maker Tesla Inc (TSLA.O) called for a faster route to all-electric sales, but the auto group said the regulations will be ""extremely challenging even in California and particularly in the early years.""
California is ahead of federal vehicle emissions rules, which currently extend only to 2026 and do not set yearly requirements for zero-emission models.
1/3
A view of cars on the road during rush hour traffic jam, while California's government authorities are expected to put into effect a plan to prohibit the sale of new gasoline-powered cars by 2035, according to local media, in San Francisco, California, U.S. August 24, 2022. REUTERS/Carlos Barria
Read More
CARB's new regulation would allow automakers to sell up to 20% PHEVs by 2035. That may boost Toyota, which is investing heavily in plug-ins, and which agreed earlier this week to recognize California's authority to set vehicle rules.
Tesla, which produces only electric vehicles, said in a July 26 filing to CARB that the board should require 100% zero-emission vehicles by 2030 and increase the stringency of the standard by ""reducing the use of polluting PHEVs in annual compliance."" It also sought changes on battery and charging cord requirements.
Tesla Senior Counsel Joseph Mendelson said on Thursday the CARB proposal ""is both achievable and paves the way for California to lead in electrifying the light duty sector.""
CARB's proposal sets tough new requirements for plug-in hybrids, which currently must have at least 10 miles (16.1 km)all-electric range and will eventually need a minimum 50-mile all-electric range label to qualify.
CARB projects that 183,000 out of about 2 million vehicles sold in California in 2035 will be plug-in hybrid.
The American Fuel & Petrochemical Manufacturers trade association on Thursday urged President Joe Biden and the Environmental Protection Agency to ""reject California’s request for a Clean Air Act waiver to proceed with this unlawful ban.""
The group said federal approval ""would hand over sweeping federal government authority to California regulators, effectively appointing Governor Newsom and CARB as car and truck czars for the entire United States.""
The White House and EPA did not immediately comment. Biden has previously declined to back setting a firm date to phase out gasoline-powered vehicles. The EPA is currently working on the next round of U.S. emissions limits through at least 2030.
Seventeen U.S. states have agreed to adopt California's tailpipe emissions rules and 15 have backed its zero-emission vehicle requirements. A group of 17 other states has challenged the EPA's decision to restore California's authority to set emissions rules that was withdrawn under former president Donald Trump.
Register now for FREE unlimited access to Reuters.com
Register
Reporting by David Shepardson in Washington Editing by Frances Kerry and Matthew Lewis
Our Standards: The Thomson Reuters Trust Principles."
6,https://www.reuters.com/,"Wall Street ends sharply up, fueled by Nvidia and Amazon","Wall Street ended sharply higher on Thursday, lifted by gains in Nvidia and other technology-related stocks as investors focused on the Federal Reserve's Jackson Hole conference for clues about the central bank's policy outlook.",https://www.reuters.com/markets/europe/futures-rise-investors-await-data-jackson-hole-2022-08-25/,https://www.reuters.com/resizer/Wow_QEIBAzXWbAG5WI-uT18Q49M=/60x0/filters:quality(80)/cloudfront-us-east-2.images.arcpublishing.com/reuters/65CBCUCVTVL75O7G3P4ZVGBLWU.jpg,2022-08-25,tesla,"Summary
Companies
Data shows mild U.S. economic contraction in second quarter
Salesforce falls after slashing outlook
Tesla slides as 3-for-1 stock split kicks in
Indexes: S&P 500 +1.41%, Nasdaq +1.67%, Dow +0.98%
Aug 25 (Reuters) - Wall Street ended sharply higher on Thursday, lifted by gains in Nvidia and other technology-related stocks as investors focused on the Federal Reserve's Jackson Hole conference for clues about the central bank's policy outlook.
Fed Chair Jerome Powell is due to give a speech on Friday that investors will dissect for indications of how aggressively the Fed may move to raise interest rates as it battles decades-high inflation.
""We're in a period of time between the end of the second-quarter earnings season and meaningful additional data from the Federal Reserve. Markets are churning a bit with a reasonably low level of volatility,"" said Bill Northey, senior investment director at U.S. Bank Wealth Management in Minneapolis.
Register now for FREE unlimited access to Reuters.com
Register
The yield on the closely watched 10-year Treasury note faded after recently hitting a two-month high. Declining interest rates tend to benefit technology stocks trading at high valuations.
""Lower interest rates have certainly put some support underneath some of the more growth-oriented sectors,"" Northey said.
Nvidia (NVDA.O) jumped 4% after the graphics chipmaker gave a weaker-than-expected quarterly forecast that many investors viewed as signaling the worst of a sales downturn may be over. That drove a rally in the Philadelphia semiconductor index (.SOX). read more
Apple (AAPL.O) and Microsoft rose more than 1%, while Amazon (AMZN.O) and Google-owner Alphabet (GOOGL.O) added more than 2%, with all four companies making substantial contributions to the Nasdaq's increase.
All 11 S&P 500 sector indexes rose, led by materials (.SPLRCM), up 2.26%, followed by a 2.06% gain in communication services (.SPLRCL).
Data earlier in the day showed the U.S. economy contracted less than initially thought in the second quarter, dispelling some fears that a recession was underway. read more
Traders see a slightly greater likelihood of a third 75-basis-point interest hike from the Fed at its policy meeting next month, compared with a 50-basis-point increase. FEDWATCH
Fed officials on Thursday were noncommittal about the size of the interest rate increase they plan to approve at their Sept. 20-21 meeting, but they continued hammering the point that rates will rise and stay high until such high rates of inflation have been squeezed from the economy. read more
Traders work on the floor of the New York Stock Exchange (NYSE) in New York City, U.S., August 17, 2022. REUTERS/Brendan McDermid/File Photo
Electric-vehicle maker Tesla Inc (TSLA.O) slid 0.35% after a 3-for-1 stock split came into effect. read more
The S&P 500 climbed 1.41% to end the session at 4,199.12 points.
The Nasdaq gained 1.67% to 12,639.27 points, while the Dow Jones Industrial Average rose 0.98% to 33,291.78 points.
Wall Street's busiest trades
Following Thursday's rally, the S&P 500 remains down about 12% in 2022, while the Nasdaq is down about 19%.
Citigroup Inc climbed 2.1% after saying it plans to close its consumer and commercial banking businesses in Russia starting this quarter. read more
Salesforce Inc (CRM.N) fell 3.4% after it cut its annual forecasts over ""measured"" spending from clients and a hit from a stronger dollar. read more
Additional chipmakers rallying on Thursday included Advanced Micro Devices (AMD.O), up 4.8%, and Broadcom (AVGO.O), which gained 3.6%.
Advancing issues outnumbered falling ones within the S&P 500 (.AD.SPX) by a 13.4-to-one ratio.
The S&P 500 posted 4 new highs and 29 new lows; the Nasdaq recorded 54 new highs and 70 new lows.
Volume on U.S. exchanges was relatively light, with 9.3 billion shares traded, compared to an average of 10.8 billion shares over the previous 20 sessions.
Register now for FREE unlimited access to Reuters.com
Register
Reporting by Bansari Mayur Kamdar, Devik Jain and Chavi Mehta in Bengaluru and by Noel Randewich in Oakland, Calif.; Editing by Maju Samuel, Aditya Soni and Grant McCool
Our Standards: The Thomson Reuters Trust Principles."
7,https://www.reuters.com/,Elon Musk's 'absurdly broad' Twitter data requests mostly rejected by judge,"Elon Musk's demands for Twitter Inc user details were rejected as ""absurdly broad"" by a judge on Thursday, although the billionaire will get some data as he pursues his bid to end his $44 billion acquisition of the company.",https://www.reuters.com/markets/deals/delaware-judge-orders-twitter-turn-over-some-data-musk-court-ruling-2022-08-25/,https://www.reuters.com/resizer/NbsTowOiJEf6csq_aTnFJ8L4vdA=/60x0/filters:quality(80)/cloudfront-us-east-2.images.arcpublishing.com/reuters/OEMRBPNGA5KMLKI3RJOYG3KCBE.jpg,2022-08-25,tesla,"WILMINGTON, Del., Aug 25 (Reuters) - Elon Musk's demands for Twitter Inc (TWTR.N) user details were rejected as ""absurdly broad"" by a judge on Thursday, although the billionaire will get some data as he pursues his bid to end his $44 billion acquisition of the company.
Chancellor Kathaleen McCormick of Delaware's Court of Chancery said many of Musk's data demands were ""absurdly broad,"" amounting to trillions of data points that ""no one in their right mind has ever tried to undertake such an effort.""
The judge said Musk, chief executive of Tesla Inc (TSLA.O), has had data and documents needed to pursue his case, much of which was provided before he said on July 8 he was terminating the deal in part because Twitter was withholding information.
Register now for FREE unlimited access to Reuters.com
Register
""My overall impression is that plaintiff has agreed to produce a tremendous amount of information to defendants, and that the information plaintiff has agreed to produce is sufficiently broad to satisfy most of plaintiff's obligations,"" wrote Chancellor Kathaleen McCormick of Delaware's Court of Chancery.
Twitter was ordered to turn over data from 9,000 accounts sampled in a fourth-quarter audit to estimate the number of spam or bot users on the social media platform.
Twitter had said that data no longer existed and it would be burdensome to recreate it, although McCormick gave the company two weeks to produce it.
""We look forward to reviewing the data Twitter has been hiding for many months,"" said Musk's attorney, Alex Spiro, in an emailed statement.
Twitter declined to comment.
Musk, the world's richest person, has said he wants to test that audit's accuracy because he believes the company fraudulently misrepresented that only 5% of its accounts were spam. He wants McCormick to rule he can walk away from the deal.
Twitter wants McCormick to order Musk to close the deal at the agreed price of $54.20 per share. The shares briefly rose about 1% after the ruling and ended up 0.6% at $41.05.
A five-day trial has been scheduled for Oct. 17.
Twitter said at a Wednesday court hearing that Musk's focus on spam was ""legally irrelevant"" because the company has described the spam count in regulatory filings as an estimate, not a representation. It also said the real level of spam could be higher.
Register now for FREE unlimited access to Reuters.com
Register
Reporting by Tom Hals in Wilmington, Delaware; editing by Jonathan Oatis and Richard Chang
Our Standards: The Thomson Reuters Trust Principles.
Tom Hals
Thomson Reuters
Award-winning reporter covering U.S. courts and law from the COVID-19 pandemic to high-profile criminal trials and Wall Street's biggest failures with more than two decades of experience in international financial news in Asia and Europe."
8,https://www.reuters.com/,Tesla shares close lower after 3-1 stock split,Tesla Inc's shares closed 2% lower on Thursday as a three-for-one stock split announced by the world's most valuable automaker to woo retail investors came into effect.,https://www.reuters.com/business/autos-transportation/tesla-shares-limelight-3-1-stock-split-kicks-2022-08-25/,https://www.reuters.com/resizer/Lv651ob1F13tLnkGWmMBsxkF-3A=/60x0/filters:quality(80)/cloudfront-us-east-2.images.arcpublishing.com/reuters/CYRWTIEV4BJ3TNV26KJMRVQKTA.jpg,2022-08-25,tesla,"Aug 25 (Reuters) - Tesla Inc's (TSLA.O) shares closed 2% lower on Thursday as a three-for-one stock split announced by the world's most valuable automaker to woo retail investors came into effect.
The stock opened at $302 and closed at $296.07 as the split allowed investors to get two additional shares for each they owned as of Aug. 17. It had closed at $891.29 before the split on Wednesday.
This is the second stock split by Tesla in as many years and follows similar moves by high-growth companies such as Amazon.com (AMZN.O) and Google-parent Alphabet (GOOGL.O) to address the growing need to diversify investor base.
Register now for FREE unlimited access to Reuters.com
Register
Stock splits ""certainly have a higher appeal to retail investors and makes their options more affordable as well,"" said Art Hogan, chief market strategist at B. Riley.
""Retail investors are a very important cohort for Tesla and today's stock split is an acknowledgment of that fact.""
Austin-based Tesla debuted in 2010 at $17 and in a decade surged to a peak price of $2,000, becoming one of the highest priced shares on Wall Street and making it difficult for small investors to bet on the high-growth stock.
The company decided to split its stock on a five-for-one basis in August 2020 and breached $1 trillion in market capitalization in 2021.
The EV maker is the sixth company in the S&P 500 index to split its shares this year, according to Howard Silverblatt, senior index analyst for S&P and Dow Jones indices.
Tesla's ticker was trending on social media stocktwits.com, indicating increased chatter among individual investors. The shares have lost about 11% of their value since March when the company announced plans to increase its number of shares.
""In typical buy-the-rumor, sell-the-news style, investors tend to drastically scale back purchases of splitting stocks in the weeks ensuing the effective split date, causing price momentum to slow,"" analysts at Vanda Research said in a note.
Tesla shares have risen to take the company's market cap to over $1 trillion since its previous split
A stock split does not affect the fundamentals of a company, but makes it easier for individual investors to do small trades. The benefits of such splits, however, are becoming less clear as brokerages let customers buy parts of a company's share.
Tesla's shares have fallen about 16% so far this year amid a selloff in high-growth stocks due to worries over aggressive interest rate hikes and geopolitical uncertainties.
Register now for FREE unlimited access to Reuters.com
Register
Reporting by Akash Sriram and Medha Singh in Bengaluru; Additional reporting by Devik Jain; Editing by Sriraj Kalluvila and Arun Koyyur
Our Standards: The Thomson Reuters Trust Principles."
9,https://www.reuters.com/,Tesla wants videos of its cars running over child dummies taken down by safety group,"Tesla Inc has demanded a safety advocacy group take down videos of its vehicles running over child dummies when its driver assistant system was engaged, calling them ""defamatory"" and ""misleading.""",https://www.reuters.com/business/autos-transportation/tesla-wants-videos-its-cars-running-over-child-dummies-taken-down-by-safety-2022-08-25/,https://www.reuters.com/resizer/-CNO3U49mqXQPmShB0QbkIkj-Ds=/60x0/filters:quality(80)/cloudfront-us-east-2.images.arcpublishing.com/reuters/34WLAEK465OVVIITC3M2XFONJ4.jpg,2022-08-25,tesla,"SAN FRANCISCO, Aug 25 (Reuters) - Tesla Inc (TSLA.O) has demanded a safety advocacy group take down videos of its vehicles running over child dummies when its driver assistant system was engaged, calling them ""defamatory"" and ""misleading.""
The group, the Dawn Project, has launched a nationwide TV campaign warning of alleged potential dangers of what Tesla calls ""Full Self-Driving"" (FSD) software, adding to public and regulatory scrutiny of the technology.
One of the videos posted by the group shows a Tesla vehicle with FSD software running over child-sized mannequins, and says ""Tell Congress to Shut it Down.""
Register now for FREE unlimited access to Reuters.com
Register
In a Cease and Desist letter dated Aug. 11, Tesla said the Dawn Project and its founder ""have been disparaging Tesla's commercial interests and disseminating defamatory information to the public."" The letter was disclosed by the Dawn Project on Thursday.
Tesla threatened to take legal action, saying the tests in the videos are ""likely fraudulent"" and ""misrepresent the capabilities of Tesla’s technology.""
The U.S. safety regulator has stepped up investigations of Tesla's Autopilot system following a series of crashes.
The company said its ""FSD Beta,"" a test version of its new automated driving technology used by a limited number of consumers, ""does recognize pedestrians, including children, and when utilized properly, the system reacts to prevent or mitigate a collision.""
The Dawn Project was founded by Dan O'Dowd, a critic of Tesla's FSD system and a software entrepreneur in California who had run for the U.S. Senate.
The Dawn Project said its tests are ""are completely legitimate and not deceptive,"" and called Tesla's letter ""marketing propaganda.""
Tesla did not immediately respond to a request for comment.
Register now for FREE unlimited access to Reuters.com
Register
Reporting by Hyunjoo Jin Editing by Bill Berkrot
Our Standards: The Thomson Reuters Trust Principles."
