,Source,title,description,url,image,date,keyword,article
0,https://www.reuters.com/,China's CATL to develop new battery materials to improve energy density -chairman,"China's CATL is working on new battery materials that can improve energy density by 10% to 20% compared to iron phosphate batteries, the company's chairman said, as the battery giant scrambles to retain its top position amid competition.",https://www.reuters.com/technology/new-catl-m3p-batteries-can-improve-energy-density-by-10-20-chairman-2022-08-27/,https://www.reuters.com/resizer/umCWb1E4ZkqPYtTeN6kBixtgDxs=/60x0/filters:quality(80)/cloudfront-us-east-2.images.arcpublishing.com/reuters/OCKCN5INR5JBBGIE5JFXUDV72M.jpg,2022-08-27,tesla,"BEIJING, Aug 27 (Reuters) - China's CATL (300750.SZ) is working on new battery materials that can improve energy density by 10% to 20% compared to iron phosphate batteries, the company's chairman said, as the battery giant scrambles to retain its top position amid competition.
The new material technology known as M3P can enable an electric vehicle to run 700 km (430 miles) per charge combined with CATL's next generation of battery pack technology, Zeng Yuqun said at the World New Energy Vehicle Congress in Beijing on Saturday.
The new materials will also lower the costs compared to nickel and cobalt-based batteries, he added.
Register now for FREE unlimited access to Reuters.com
Register
Zeng, however, didn't say what metals M3P batteries will use or when mass production could start.
CATL, whose clients include Tesla(TSLA.O), Volkswagen(VOWG_p.DE), BMW(BMWG.DE) and Ford(F.N), is the world's biggest battery maker accounting for more than a third of the sales of batteries for electric vehicles (EV) worldwide.
It aims to increase the lead over rivals such as LG Energy Solution (373220.KS) and BYD by accelerating expansions globally and innovation in new battery technologies.
Wan Gang, Vice Chairman of China's national advisory body for policy making, said the global market size of EV batteries is expected to reach $250 billion by 2030, with demand exceeding 3.5 terrawatt hours. read more
CATL said in a separate announcement on Saturday that it will supply Qilin batteries with its latest battery pack technology to power Geely Automobile Holdings 's Zeekr cars due to hit the market in early 2023.
CALT launched the Qilin battery in June and touted a 13% higher energy density compared to the same size of pack of Tesla's 4680 cylindrical battery cells-- denoting 46 millimetres in diameter and 80 millimetres in length, while using same type of materials.
Register now for FREE unlimited access to Reuters.com
Register
Reporting by Zhang Yan and Josh Horwitz; Editing by William Mallard & Simon Cameron-Moore
Our Standards: The Thomson Reuters Trust Principles."
1,https://www.reuters.com/,Analysis: Musk tests limits of governance by having children with aide,"Elon Musk's decision to have children with one of his top executives at Neuralink pushed the limits of corporate governance norms, according to nine corporate governance experts.",https://www.reuters.com/business/musk-tests-limits-governance-by-having-children-with-aide-2022-08-26/,https://www.reuters.com/resizer/7RyIzCGk68nd4jlQYdqX2-O6VoU=/60x0/filters:quality(80)/cloudfront-us-east-2.images.arcpublishing.com/reuters/WLG75LXJB5LZPM5AGQWSXGLIUM.jpg,2022-08-26,tesla,"Aug 26 (Reuters) - Elon Musk's decision to have children with one of his top executives at Neuralink pushed the limits of corporate governance norms, according to nine corporate governance experts who offered divergent interpretations of the startup's code of conduct for employees.
Known more widely for his electric car maker Tesla Inc (TSLA.O) and rocket developer SpaceX, Musk is also the chief executive of Neuralink, a company with about 300 employees that is seeking to develop chips that connect the human brain directly to machines.
He and Shivon Zilis, one of his direct reports at the company, had twin babies last November, Insider reported on July 6, citing a confidential court filing.
Register now for FREE unlimited access to Reuters.com
Register
Zilis, 36, has since told some of her colleagues that she was not involved romantically with Musk, 51, and conceived the children with him through in vitro fertilization (IVF), according to five people familiar with the situation. Reuters could not establish the accuracy of Zilis’ account.
Zilis and spokespeople for Musk and Neuralink did not respond to requests for comment.
Relationships between supervisors and subordinates are frowned upon at companies and have cost some high-profile CEOs their jobs, as they violate most corporate policies and raise concerns about conflicts of interest, corporate governance experts said.
Neuralink’s 62-page employee handbook, a copy of which was seen by Reuters, prohibits dating, “personal relationships” and “close personal friendships” between employees in a direct supervisory relationship to avoid any conflicts of interest.
But the facts presented by Musk and Zilis’ relationship are so unusual that the corporate governance experts who reviewed the policy for Reuters expressed divergent views on whether they thought the entrepreneur had violated it by having children with his subordinate through IVF.
“Whatever lawyer wrote this language did not contemplate this situation,” said Nell Minow, vice chair of corporate governance consultancy ValueEdge Advisors, referring to the Neuralink code of conduct.
She added that the situation appeared to “fall between the cracks” of the policy’s intent to avoid conflicts of interest due to relationships between employees.
Neuralink’s code of conduct calls for relationships that can create a conflict of interest to be disclosed to the company’s “people operations manager” so that the company can decide whether it should take steps to eliminate any conflict.
Reuters could not learn whether Musk or Zilis had disclosed the relationship to Kristy Hilands, the people operations manager. Hilands did not respond to requests for comment.
Neuralink has accepted Zilis’ description of a non-romantic relationship, and she continues in her role as director of operations and special projects, a source familiar with the company’s handling of the matter said. In the weeks since the disclosure of their having children, Musk and Zilis have also continued working together, taking the helm at internal and external company meetings, according to two people with direct knowledge of the matter.
For example, after learning in recent weeks that competitor Synchron had beaten Neuralink to a human trial in the United States, Musk sent Zilis to approach the company’s CEO Thomas Oxley and arrange a meeting, according to three sources familiar with the matter. Zilis and Musk spoke with Oxley shortly after about a possible investment by Musk in Synchron, the sources said.
OPEN TO INTERPRETATION
Four of the corporate governance experts said they believed Zilis having children with Musk through IVF should be read as having a “personal relationship” or “close friendship” under Neuralink’s code of conduct. The code defines a personal relationship as one where the individuals have a “continuing relationship of a romantic or intimate nature and who are not married to each other.” It does not define a close friendship.
“You’re layering intimate familial bonds over professional relationships,” said Gabriel Rauterberg, a corporate law professor at the University of Michigan. “There is always the worry that someone with greater power will use their professional power in ways that are inappropriate.”
The other five corporate governance experts interviewed by Reuters either did not think Musk and Zilis’ arrangement was a breach under the Neuralink policy or could not come to a definitive conclusion.
Usha Rodrigues, a professor at the University of Georgia’s law school, said Musk and Zilis’ situation “may fall under ‘close friendship’ if there is an ongoing, co-parenting type relationship, but that is subject to interpretation.”
The extent of Musk’s involvement in the life of his children with Zilis could not be learned by Reuters. The court filing published by Insider shows that in April, they asked for the children to take Musk’s last name. Musk and Zilis also listed the same address in Texas.
Joan Heminway, a business professor at the University of Tennessee’s law school, said one cannot easily prove that Musk and Zilis are close personally, even if they had IVF together. “That’s the new wrench here,” she said.
Register now for FREE unlimited access to Reuters.com
Register
Reporting by Rachael Levy in Washington, D.C. Editing by Greg Roumeliotis, Paritosh Bansal and Edward Tobin
Our Standards: The Thomson Reuters Trust Principles.
Rachael Levy
Thomson Reuters
Award-winning journalist covering corporate governance. Her reporting has prompted federal investigations and congressional probes and been featured on television and podcasts. At Politico, her Covid-19 coverage caused the CDC to update guidance on N95 masks and the U.S. hospital regulator to seek patients' safety complaints. Formerly a financial reporter at the Wall Street Journal, her exclusives on the Trump White House's Kodak drug deal won her and colleagues a 2021 Dateline Award from the Society of Professional Journalists."
2,https://www.reuters.com/,Tesla supplier Panasonic plans additional $4 bln U.S. EV battery plant - WSJ,"Panasonic Holdings Corp , a supplier to electric-car maker Tesla Inc , is in talks to build an additional electric vehicle (EV) battery plant in the United States at a cost of around $4 billion, the Wall Street Journal reported on Friday, citing people familiar with the matter.",https://www.reuters.com/business/autos-transportation/panasonic-plans-additional-4-bln-ev-battery-plant-us-wsj-2022-08-26/,https://www.reuters.com/resizer/ZmGlqIbnmlsq-Rxv52n5fg6woxc=/60x0/filters:quality(80)/cloudfront-us-east-2.images.arcpublishing.com/reuters/W5OJH237WVI3XGANUEATNNCIFI.jpg,2022-08-26,tesla,"Aug 26 (Reuters) - Panasonic Holdings Corp (6752.T), a supplier to electric-car maker Tesla Inc (TSLA.O), is in talks to build an additional electric vehicle (EV) battery plant in the United States at a cost of around $4 billion, the Wall Street Journal reported on Friday, citing people familiar with the matter.
Panasonic is looking at Oklahoma as the location for its new plant, the newspaper said. (https://on.wsj.com/3pJJs1F)
A Panasonic spokesperson said: ""We are examining various growth strategies for our automotive battery business, but there is no further information that we can share at the moment aside from what we have already announced.""
Register now for FREE unlimited access to Reuters.com
Register
In July, Panasonic selected Kansas as the site for a new battery plant that state officials said would create up to 4,000 jobs with investment of up to $4 billion. read more
At that time, the Oklahoma Department of Commerce said it and its partners ""continue(d) to work with Project Ocean,"" Panasonic's battery factory project, and were ""optimistic for additional opportunities with them in the future"".
The department said on Friday that ""due to non-discourse agreements (on projects), we will not be providing comments on this story"".
Earlier this year, Oklahoma said it would allocate $698 million to pursue Project Ocean under a bill aimed at attracting an unidentified company that will invest a minimum of $3.6 billion and create at least 4,000 new jobs within five years.
Oklahoma is a neighbouring state to Texas, home to Tesla's car and battery production facilities.
The Japanese conglomerate also said it was looking at potential factory sites in Kansas and Oklahoma to supply the batteries to Tesla's plant in Texas. read more
Panasonic has partnered with Tesla for more than a decade, supplying batteries from its factory in Nevada, California.
The auto industry has been ramping up production of EVs to meet a surge in demand, driving up orders for batteries and raw materials such as lithium and cobalt, among others.
Tesla did not immediately respond to a Reuters request for comment.
Register now for FREE unlimited access to Reuters.com
Register
Reporting by Jaiveer Singh Shekhawat in Bengaluru, Hyunjoo Jin in San Francisco, Satoshi Sugiyama in Tokyo; Editing by Jacqueline Wong and Jan Harvey
Our Standards: The Thomson Reuters Trust Principles."
3,https://www.reuters.com/,Factbox: Automakers accelerate drive to secure battery raw materials,"Rising demand for electric vehicles (EV) around the world is encouraging automakers such as Tesla Inc , Volkswagen and Stellantis NV to step up efforts to secure raw materials needed for making batteries.",https://www.reuters.com/technology/automakers-securing-battery-raw-materials-2022-03-23/,https://www.reuters.com/resizer/LWjqTwswbrdQ52bF2V7l1i5sObw=/60x0/filters:quality(80)/cloudfront-us-east-2.images.arcpublishing.com/reuters/QTJYDCW3DBKXZMKA3BZ5KDDSLY.jpg,2022-03-23,tesla,"Aug 26 (Reuters) - Rising demand for electric vehicles (EV) around the world is encouraging automakers such as Tesla Inc (TSLA.O), Volkswagen (VOWG_p.DE) and Stellantis NV (STLA.MI) to step up efforts to secure raw materials needed for making batteries.
Following are some of the deals major automakers have announced with suppliers and miners:
TESLA (TSLA.O):
Register now for FREE unlimited access to Reuters.com
Register
26-Aug-2022 - Panasonic Holdings Corp (6752.T), a supplier to Tesla, is in talks to build an additional EV battery plant in the United States at a cost of about $4 billion. read more
01-Mar-2022 - Australia's Core Lithium (CXO.AX) will supply up to 110,000 dry metric tonnes of Spodumene concentrate, a chief source of lithium, over four years starting in the second half of 2023. read more
01-Nov-2021 - China's Ganfeng Lithium (002460.SZ) will supply undisclosed volumes of battery-grade lithium for three years starting 2022 read more
22-July-2021 - Australia's BHP Group (BHP.AX) will supply nickel from its plants in Western Australia. Quantities, timing not disclosed. read more
VOLKSWAGEN (VOWG_p.DE):
23-Aug-2022 - Volkswagen intensified efforts to secure access to key battery materials lithium, nickel and cobalt by striking a cooperation agreement with top supplier Canada. No financial details were disclosed. read more
08-Dec-2021 - Vulcan Energy Resources (VUL.AX) will provide lithium hydroxide for five years starting 2026. Vulcan extracts lithium from geothermal sources in Germany's Upper Rhine Valley region. read more
08-Dec-2021 - Belgium's Umicore (UMI.BR) will supply cathode materials for Volkswagen's European battery cell factories under a joint venture. It will start production in 2025 with 20 gigawatt hours for the carmaker's plant in Salzgitter, Germany. read more
STELLANTIS (STLA.MI):
24-June-2022 - Stellantis will invest 50 million euros ($50.3 million) to buy an 8% stake in German-Australian start-up miner Vulcan (VUL.AX), becoming its second largest shareholder and extending a lithium supply agreement to 10 years. read more
2-June-2022 - Controlled Thermal Resources will supply up to 25,000 metric tons per year of lithium hydroxide over 10 years from a project in California. read more
29-Nov-2021 - Preliminary deal with Vulcan (VUL.AX) for lithium produced using geothermal energy from Germany. Over five years starting in 2026, Vulcan will supply 81,000-99,000 tonnes of battery-grade lithium hydroxide. read more
RENAULT (RENA.PA):
1-June-2022 - Moroccan miner Managem (MNG.CS) will supply 5,000 tonnes of low carbon cobalt sulphate under a seven-year deal starting from 2025.
21-Nov-2021 - Vulcan (VUL.AX) will supply 26,000-32,000 metric tonnes of battery-grade lithium chemicals for initial six years starting 2026. read more
08-Oct-2021 - MoU with Finnish nickel and cobalt miner Terrafame to supply nickel sulphate. Quantities and timeline not disclosed.
MERCEDES BENZ (MBGn.DE):
23-Aug-2022 - Mercedes-Benz strikes cooperation agreement with Canada to secure access to lithium, nickel and cobalt. It will explore a strategic partnership with Rock Tech Lithium (RCK.V) which would supply the carmaker and its battery partners with up to 10,000 tonnes of lithium hydroxide a year from 2026. read more
BMW (BMWG.DE):
5-Aug-2022 - BMW signs a non-binding memorandum of understanding with European Lithium Ltd (EUR.AX) for the supply of lithium hydroxide.
7-June-2022 - U.S. startup Lilac Solutions, backed by BMW, was competing for mining partnerships in Bolivia to tap into the world's largest resources of lithium. read more
TOYOTA (7203.T):
1-Aug-2022 - A joint venture of Toyota and Panasonic (6752.T) will buy lithium from ioneer Ltd's (INR.AX) Rhyolite Ridge mining project in Nevada to build EV batteries in the United States. read more
04-Oct-2021 - BHP Group (BHP.AX) will supply nickel sulphate from Western Australia to Toyota and Panasonic's joint venture. Details were not disclosed. read more
GENERAL MOTORS (GM.N)
3-Aug-2022 - GM makes prepayment of $198 million to Livent Corp (LTHM.N) for a guaranteed six-year supply of lithium from 2025 at a contractual price per tonne. Volume not disclosed. read more
02-July-2021 - GM will make a ""multimillion-dollar investment"" in and help develop Controlled Thermal Resources Ltd's Hell's Kitchen geothermal brine project near California's Salton Sea. The project could be producing 60,000 tonnes of lithium - enough to make roughly 6 million EVs - by mid-2024. read more
12-April-2022 - Miner Glencore (GLEN.L) will supply cobalt, secured from its Murrin Murrin operation in Australia, to be used in GM's Ultium battery cathodes. Details were not disclosed. read more
FORD (F.N)
22-July-2022 - Ioneer Ltd signs binding offtake agreement with Ford to supply lithium from Rhyolite Ridge in Nevada.
14-July-2022 - Ford Motor, SK On and SK Battery America create joint venture to build and operate an EV battery plant in Tennessee and two plants in Kentucky.
29-June-2022 - Australia's Liontown Resources (LTR.AX) will supply up to 150,000 dry metric tonnes per year of spodumene concentrate, a source of lithium, from its Kathleen Valley project in Western Australia for five years starting 2024. read more
11-Apr-2022 - Ford signs preliminary deal to purchase 25,000 tonnes of lithium annually from Lake Resources' (LKE.AX) Kachi project in northern Argentina. read more
22-Sept-2021 - Ford partners with startup Redwood Materials to form a ""closed loop"" or circular supply chain for electric vehicle batteries, from raw materials to recycling. read more
($1 = 0.9939 euros)
Register now for FREE unlimited access to Reuters.com
Register
Reporting by Bartosz Dabrowski, Ina Kreutz, Agnieszka Gosciak, Tristan Chabba, Dagmarah Mackos, Zuzanna Lebek, Alicja Zawadzka in Gdansk and Nilanjana Basu, Yuvraj Malik and Kannaki Deka in Bengaluru; editing by Milla Nissi and Susan Fenton
Our Standards: The Thomson Reuters Trust Principles."
4,https://www.reuters.com/,Russia says it would be ready to extend spaceflight sharing deal with U.S.,"Russia would be ready to extend a deal with the United States to share flights to the International Space Station beyond 2024 if the first three flights are successful, the executive director of Russia's space agency said on Friday.",https://www.reuters.com/lifestyle/science/russia-says-it-would-be-ready-extend-spaceflight-sharing-deal-with-us-2022-08-26/,https://www.reuters.com/resizer/LUJMTyc0tLJrw2A14qRYu7-Puws=/60x0/filters:quality(80)/cloudfront-us-east-2.images.arcpublishing.com/reuters/LP66ILZHQJIBHHDQLQK7D2XXPM.jpg,2022-08-26,tesla,"Aug 26 (Reuters) - Russia would be ready to extend a deal with the United States to share flights to the International Space Station beyond 2024 if the first three flights are successful, the executive director of Russia's space agency said on Friday.
NASA and Russian space agency Roscosmos signed an agreement in July allowing Russian cosmonauts to fly on U.S.-made spacecraft in exchange for American astronauts being able to ride on Russia's Soyuz spacecraft. read more
Russia's RIA news agency reported at the time that the agreement envisaged six flights in total between 2022 and 2024, with each country getting three flights each on the other's spacecraft.
Register now for FREE unlimited access to Reuters.com
Register
""The agreement has now been signed for the first three flights,"" said Sergei Krikalev, executive director of Roscosmos
""If the implementation of this agreement will be positive then we will certainly continue it.""
The deal is an unusual example of Moscow and Washington still cooperating at a time when ties are at a post-Cold War low due to tensions over what Russia calls its ""special military operation"" in Ukraine, a conflict the West calls an unprovoked war of aggression.
Russia has cast doubt over space cooperation in other areas and spoken of pulling out of the International Space Station after 2024 to develop its own orbital station. It has so far sent mixed messages however, suggesting that date could significantly slip.
The flight sharing agreement signed in July will see Russian cosmonaut Anna Kikina fly on a Crew Dragon spacecraft developed by U.S. aerospace manufacturer SpaceX in the autumn.
Kikina, who will be the first cosmonaut to fly on a Crew Dragon ship, told reporters on Friday she was initially shocked to learn she would not fly on Soyuz, Russia's flagship spacecraft that has been used since the 1960s.
""Well considering the fact that all my professional life I was preparing to fly on Soyuz, I was preparing for it, in principle, and was focusing on it... suddenly the thought settled in my head that - no - I'm not flying a Soyuz, how can that be?"" Kikina said.
""But then I had a rethink. Yes I realised that I might be going on another ship, but with the knowledge that I would definitely go on Soyuz too.""
She said she would be observing the U.S. tradition of driving to the launch pad in a Tesla (TSLA.O) produced by the carmaker headed by billionaire Elon Musk, who also founded SpaceX.
""Of course I will observe crew traditions, because I am part of this crew,"" she said.
Space exploration was one of the few areas where the Soviet Union and the United States cooperated during the Cold War, culminating in a symbolic ""space handshake"" between a cosmonaut and an astronaut during the Apollo–Soyuz mission in 1975.
Register now for FREE unlimited access to Reuters.com
Register
Reporting by Reuters reporters Editing by Andrew Osborn
Our Standards: The Thomson Reuters Trust Principles."
